{
  "break_coefficients": [],
  "claim": "benchmark_recovery_not_real_causal_marketing_roi",
  "coefficients": {
    "annual_cos_1": {
      "confidence_level": 0.95,
      "estimate": -48.45791596476089,
      "lower": -155.35596032018833,
      "standard_error": 54.54082074906762,
      "upper": 58.44012839066654
    },
    "annual_sin_1": {
      "confidence_level": 0.95,
      "estimate": 397.97149640164014,
      "lower": 270.1454818920938,
      "standard_error": 65.21855274781662,
      "upper": 525.7975109111865
    },
    "intercept": {
      "confidence_level": 0.95,
      "estimate": 2411.4039480864044,
      "lower": 1194.4074510093235,
      "standard_error": 620.927989838892,
      "upper": 3628.4004451634855
    },
    "media": {
      "confidence_level": 0.95,
      "estimate": -460.5633210338272,
      "lower": -2173.5224239877825,
      "standard_error": 873.9747854886916,
      "upper": 1252.395781920128
    },
    "quarter_end": null,
    "trend": {
      "confidence_level": 0.95,
      "estimate": 31.93588430899789,
      "lower": 27.520841992117028,
      "standard_error": 2.2526140029644184,
      "upper": 36.35092662587875
    }
  },
  "contribution": {
    "end": "2023-12",
    "monthly_estimate": [
      -339.9000354137879,
      -342.3844249220676,
      -354.64891755445365,
      -334.5585493975537,
      -331.81503162456977,
      -356.79884953003744,
      -335.3267957457811,
      -382.50152417820976,
      -354.41922353387247,
      -348.53990215577846,
      -337.95959683821405,
      -312.15392270686476
    ],
    "start": "2023-01",
    "total": {
      "confidence_level": 0.95,
      "estimate": -4131.006773601191,
      "lower": -19495.334183175506,
      "standard_error": 7839.086600961125,
      "upper": 11233.320635973127
    },
    "unit": "count_equivalent"
  },
  "data_sha256": "1700c002d5712cad3ea18c857ad707331541a1d2d992831466187b60a0d04fe0",
  "diagnostics": {
    "condition_number_limit": 100000000.0,
    "design_columns": 5,
    "flags": [],
    "rank": 5,
    "scaled_condition_number": 1.3615625310751769
  },
  "manifest": {
    "path": "safe/without-quarter.manifest.json",
    "sha256": "2f22e367f2e4393bcdef23beb11aea4b2050760f5996908897a2f28f2ccb6951"
  },
  "metrics": {
    "test": {
      "mae": 280.6784677052853,
      "n": 12,
      "rmse": 350.2820419673308
    },
    "train": {
      "mae": 209.66429054485192,
      "n": 60,
      "rmse": 266.68475362472464
    }
  },
  "parameters": {
    "alpha": 0.5,
    "k": 100,
    "l_max": 3,
    "n": 1.5,
    "normalize": false
  },
  "purpose": "development_benchmark",
  "response_curve": {
    "estimate": [
      -236.9155917177041,
      -260.43126455922885,
      -280.6077682614155,
      -297.96043220222066,
      -312.9411785085436,
      -325.93303027516083,
      -337.25511548750677,
      -347.17121075860234,
      -355.8987379004604,
      -363.6169695665891,
      -370.4740509121673,
      -376.59281626545635,
      -382.07552553876354,
      -387.0076872281082,
      -391.4611322968245,
      -395.4964837722441,
      -399.16514312839865,
      -402.51089183586066,
      -405.5711867726749,
      -408.3782119079171,
      -410.9597355514411
    ],
    "interval_kind": "pointwise_not_simultaneous",
    "lower": [
      -1118.068521033925,
      -1229.0453181472594,
      -1324.2636762569236,
      -1406.1555735678126,
      -1476.8537523801751,
      -1538.165801894847,
      -1591.5977730733052,
      -1638.3944988345875,
      -1679.5820513001413,
      -1716.006466432043,
      -1748.3668811395526,
      -1777.242983718977,
      -1803.1173662533686,
      -1826.3935663781645,
      -1847.4105737662576,
      -1866.454484820244,
      -1883.7678769476838,
      -1899.557366706384,
      -1913.9997231976722,
      -1927.2468312445117,
      -1939.429736984072
    ],
    "upper": [
      644.2373375985167,
      708.1827890288016,
      763.0481397340927,
      810.2347091633713,
      850.971395363088,
      886.2997413445254,
      917.0875420982916,
      944.0520773173829,
      967.7845754992204,
      988.7725272988647,
      1007.418779315218,
      1024.0573511880643,
      1038.9663151758416,
      1052.3781919219482,
      1064.4883091726088,
      1075.4615172757558,
      1085.4375906908863,
      1094.535583034663,
      1102.8573496523222,
      1110.4904074286774,
      1117.5102658811898
    ]
  },
  "response_grid": {
    "history": "constant_spend_for_full_finite_kernel",
    "spend": [
      55.422336124977534,
      63.569632740830706,
      71.71692935668388,
      79.86422597253704,
      88.01152258839022,
      96.1588192042434,
      104.30611582009657,
      112.45341243594973,
      120.60070905180291,
      128.7480056676561,
      136.89530228350924,
      145.04259889936242,
      153.1898955152156,
      161.33719213106878,
      169.48448874692195,
      177.6317853627751,
      185.77908197862828,
      193.92637859448146,
      202.07367521033464,
      210.2209718261878,
      218.36826844204097
    ],
    "support": "common_training_spend_range",
    "unit": "synthetic_currency_per_month"
  },
  "run_id": "without-quarter",
  "schema_version": "0.2.0",
  "software": {
    "hypoforge_commit": "c47f636d24a39a820574a13133d6af693134a180",
    "numpy": "2.3.5",
    "python": "3.12.14"
  },
  "split": {
    "test_end": "2023-12",
    "test_start": "2023-01",
    "train_end": "2022-12",
    "train_start": "2018-01"
  },
  "stage": "A",
  "status": "success",
  "target": "semi_synthetic_outcome",
  "training_spend_range": {
    "max": 218.36826844204097,
    "min": 55.422336124977534
  },
  "uncertainty": {
    "conditioning": "fixed_predeclared_transforms_and_controls",
    "confidence_level": 0.95,
    "finite_sample_correction": "n_over_n_minus_p",
    "max_lags": 3,
    "method": "newey_west_bartlett",
    "reference_distribution": "normal"
  }
}
